{
  "$schema": "https://json-schema.org/draft/2020-12/schema",
  "$id": "https://saifen.local/schema/behavior_model.json",
  "title": "SAIFEN behavior model.json",
  "type": "object",
  "required": [
    "version",
    "type",
    "feature_names",
    "scaler",
    "coef",
    "intercept",
    "threshold",
    "window_ms",
    "overlap",
    "sample_rate_hz",
    "label_positive"
  ],
  "additionalProperties": true,
  "properties": {
    "version": { "type": "string" },
    "type": { "const": "logistic_regression" },
    "feature_names": {
      "type": "array",
      "minItems": 1,
      "items": { "type": "string" }
    },
    "scaler": {
      "type": "object",
      "required": ["mean", "scale"],
      "properties": {
        "mean": { "type": "array", "items": { "type": "number" } },
        "scale": { "type": "array", "items": { "type": "number" } }
      }
    },
    "coef": { "type": "array", "items": { "type": "number" } },
    "intercept": { "type": "number" },
    "threshold": { "type": "number" },
    "window_ms": { "type": "integer" },
    "overlap": { "type": "number" },
    "sample_rate_hz": { "type": "number" },
    "label_positive": { "type": "string" }
  }
}
