{
  "version": "1.0.0",
  "type": "logistic_regression",
  "feature_names": [
    "ax_mean",
    "ax_std",
    "ax_min",
    "ax_max",
    "ax_rms",
    "ax_energy",
    "ay_mean",
    "ay_std",
    "ay_min",
    "ay_max",
    "ay_rms",
    "ay_energy",
    "az_mean",
    "az_std",
    "az_min",
    "az_max",
    "az_rms",
    "az_energy",
    "gx_mean",
    "gx_std",
    "gx_min",
    "gx_max",
    "gx_rms",
    "gx_energy",
    "gy_mean",
    "gy_std",
    "gy_min",
    "gy_max",
    "gy_rms",
    "gy_energy",
    "gz_mean",
    "gz_std",
    "gz_min",
    "gz_max",
    "gz_rms",
    "gz_energy",
    "mag_a_mean",
    "mag_a_std",
    "mag_a_min",
    "mag_a_max",
    "mag_a_rms",
    "mag_a_energy",
    "sma_accel"
  ],
  "scaler": {
    "mean": [
      0.0010270894150775302,
      0.24170491097572974,
      -0.3954520267945739,
      0.3965234776680458,
      0.24223094263274242,
      8.082793006344772,
      0.004447745924031468,
      0.28738483896552147,
      -0.4606104567750672,
      0.458280135577194,
      0.2891283032133489,
      11.585429277971366,
      9.05415029666326,
      0.11528661965462944,
      8.80959907934352,
      9.29492054626959,
      9.054895327506367,
      8241.532571797197,
      0.0003121001476675422,
      0.034843957270334645,
      -0.07494381249422005,
      0.08091191985157536,
      0.035023494405146044,
      0.12297073527217604,
      4.204310776426778e-05,
      0.027887944068699436,
      -0.06653255922800011,
      0.06837843518665047,
      0.027986380463776037,
      0.07856403831214362,
      -9.720478190441406e-05,
      0.019761070666912697,
      -0.04827867806995319,
      0.04770305778542425,
      0.019870445850317123,
      0.03972131043744544,
      9.065754328993991,
      0.11539179149735078,
      8.821682621117043,
      9.305046671257754,
      9.066499639087723,
      8261.200794081513,
      9.528235555142372
    ],
    "scale": [
      0.014474487629628061,
      0.14898355737750216,
      0.21252685116699885,
      0.21246003680414685,
      0.14883581724403833,
      7.215260777801849,
      0.031533144038143286,
      0.1795831993693729,
      0.24822912350058646,
      0.2453072362516924,
      0.17960823216290345,
      10.396760854793248,
      0.6513785512916624,
      0.010153898284764283,
      0.6612551168574334,
      0.6491808970090545,
      0.6513035589303469,
      1179.4963865583527,
      0.0035375902939663102,
      0.0017303302790840028,
      0.007934703425155674,
      0.010389727551086978,
      0.0017499121047824925,
      0.01224726244793058,
      0.0023384972216476015,
      0.0015596864633521841,
      0.008560147023413962,
      0.007206978390642427,
      0.0015501263362098056,
      0.00863559933957694,
      0.002063963328971095,
      0.0015632648779955504,
      0.007545356458317936,
      0.008945561738561609,
      0.001542234121030067,
      0.0061933451192160045,
      0.6408499726587634,
      0.010120975256462326,
      0.6502147112927619,
      0.6401320542815933,
      0.6407747148860514,
      1161.9176130842436,
      0.35344125089616735
    ]
  },
  "coef": [
    -0.0030290619786374658,
    -0.22948190917267025,
    0.2276730128273752,
    -0.22942309338591368,
    -0.2294805414283655,
    -0.22923535879986462,
    0.0006549481373937903,
    -0.22971236415179283,
    0.228374346709261,
    -0.22904431429446917,
    -0.22967117584085614,
    -0.2294549812938326,
    0.22922067826221992,
    -0.02609750082897746,
    0.22937729155984815,
    0.23010113182411243,
    0.229222528366228,
    0.22923953835035507,
    0.003838110213563624,
    0.010691566634112852,
    0.0010287113855945368,
    -0.0030208105775658047,
    0.02177348538510105,
    0.02045093420461066,
    -0.03872059399024761,
    -0.05013383941932342,
    0.08031739821249283,
    0.01568063926629747,
    -0.04481184162803546,
    -0.04523371920790457,
    0.03706074664927744,
    0.03863239067126521,
    0.021137070960020155,
    0.017725633801967153,
    0.03897653371190163,
    0.04022603982782651,
    0.22921286080275163,
    -0.0285306081214388,
    0.22970013210141083,
    0.23021229937476217,
    0.2292147223639253,
    0.2292310768685718,
    0.22859923147110667
  ],
  "intercept": -0.0018108935997725299,
  "threshold": 0.9849325257151621,
  "window_ms": 2000,
  "overlap": 0.5,
  "sample_rate_hz": 50,
  "label_positive": "genuine"
}